{
  "session_id": "3f1a7c20-9b4e-4d2a-8f6c-1e2d3a4b5c60",
  "student_id": "7b2e4d10-5c6f-4a8b-9d0e-2f3a4b5c6d71",
  "question_id": null,
  "event_type": "copy_attempt",
  "started_at": "2026-10-03T14:37:11.000Z",
  "duration_ms": 0,
  "metadata": { "source": "electron_input", "shortcut": "Alt+C" },
  "evidence_path": null
}
