{
  "session_id": "3f1a7c20-9b4e-4d2a-8f6c-1e2d3a4b5c60",
  "student_id": "7b2e4d10-5c6f-4a8b-9d0e-2f3a4b5c6d71",
  "question_id": null,
  "event_type": "prohibited_object",
  "started_at": "2026-10-03T14:38:55.000Z",
  "duration_ms": 1200,
  "metadata": {
    "source": "mediapipe",
    "object_name": "cell phone",
    "score": 0.82,
    "score_threshold": 0.55
  },
  "evidence_path": null
}
