{
  "session_id": "3f1a7c20-9b4e-4d2a-8f6c-1e2d3a4b5c60",
  "student_id": "7b2e4d10-5c6f-4a8b-9d0e-2f3a4b5c6d71",
  "question_id": null,
  "event_type": "screen_share",
  "started_at": "2026-10-03T14:33:47.000Z",
  "duration_ms": 15000,
  "metadata": {
    "source": "electron_main",
    "detected_by": "content_protection_probe",
    "process_name": "zoom.exe"
  },
  "evidence_path": null
}
