{
  "session_id": "3f1a7c20-9b4e-4d2a-8f6c-1e2d3a4b5c60",
  "student_id": "7b2e4d10-5c6f-4a8b-9d0e-2f3a4b5c6d71",
  "question_id": null,
  "event_type": "face_absent",
  "started_at": "2026-10-03T14:25:10.500Z",
  "duration_ms": 6300,
  "metadata": {
    "source": "mediapipe_face_landmarker",
    "faces_detected": 0,
    "min_duration_ms": 5000
  },
  "evidence_path": "3f1a7c20-9b4e-4d2a-8f6c-1e2d3a4b5c60/7b2e4d10-5c6f-4a8b-9d0e-2f3a4b5c6d71/5d2e3f4a-6b7c-4d8e-9f0a-1b2c3d4e5f02.jpg"
}
