{
  "session_id": "3f1a7c20-9b4e-4d2a-8f6c-1e2d3a4b5c60",
  "student_id": "7b2e4d10-5c6f-4a8b-9d0e-2f3a4b5c6d71",
  "question_id": "a9c8b7d6-1e2f-4a3b-8c9d-0e1f2a3b4c82",
  "event_type": "gaze_away",
  "started_at": "2026-10-03T14:23:41.000Z",
  "duration_ms": 4200,
  "metadata": {
    "source": "mediapipe_face_landmarker",
    "yaw_deg": -31.4,
    "pitch_deg": 3.1,
    "threshold_deg": 25,
    "min_duration_ms": 3000
  },
  "evidence_path": "3f1a7c20-9b4e-4d2a-8f6c-1e2d3a4b5c60/7b2e4d10-5c6f-4a8b-9d0e-2f3a4b5c6d71/4c1d2e3f-5a6b-4c7d-8e9f-0a1b2c3d4e91.jpg"
}
