{
  "session_id": "3f1a7c20-9b4e-4d2a-8f6c-1e2d3a4b5c60",
  "student_id": "7b2e4d10-5c6f-4a8b-9d0e-2f3a4b5c6d71",
  "question_id": null,
  "event_type": "extra_person",
  "started_at": "2026-10-03T14:27:02.750Z",
  "duration_ms": 2100,
  "metadata": {
    "source": "mediapipe_face_landmarker",
    "faces_detected": 2
  },
  "evidence_path": "3f1a7c20-9b4e-4d2a-8f6c-1e2d3a4b5c60/7b2e4d10-5c6f-4a8b-9d0e-2f3a4b5c6d71/6e3f4a5b-7c8d-4e9f-0a1b-2c3d4e5f6a13.jpg"
}
